{"$id":"urn:night-voyager:schema:evidence-loop-holdout-manifest-v1","$schema":"https://json-schema.org/draft/2020-12/schema","additionalProperties":false,"properties":{"a2_contract_basis":{"additionalProperties":false,"properties":{"basename":{"minLength":1,"type":"string"},"byte_length":{"minimum":1,"type":"integer"},"sha256":{"pattern":"^[0-9a-f]{64}$","type":"string"}},"required":["basename","byte_length","sha256"],"type":"object"},"author_revision":{"const":3,"type":"integer"},"authority_graph":{"additionalProperties":false,"properties":{"dataset_author":{"const":"authors revision-3 semantics and commitments; has no custody, seal, or reveal authority","type":"string"},"dra":{"const":"owns the frozen governed A2 baseline values and their provenance contract","type":"string"},"holdout_custodian":{"const":"a later independent v3 custodian may own custody, seal, and one-way reveal; no custodian action is present here","type":"string"},"mke":{"const":"owns producer-native ingestion, active Publication, Evidence descriptors, and trace identifiers","type":"string"},"night_voyager":{"const":"owns evaluator-v1 case identity, thresholds, admissibility, mappings, and outcome decisions","type":"string"}},"required":["dataset_author","dra","holdout_custodian","mke","night_voyager"],"type":"object"},"baseline_fixture_boundary":{"additionalProperties":false,"properties":{"a2_projection_and_hash_contract_required":{"const":true},"nature":{"const":"deterministic_public_safe_synthetic_governed_fixture","type":"string"},"production_or_historical_user_receipt_claimed":{"const":false}},"required":["nature","production_or_historical_user_receipt_claimed","a2_projection_and_hash_contract_required"],"type":"object"},"baseline_hash_projection_keys":{"additionalProperties":false,"properties":{"export_sha256":{"items":{"type":"string"},"minItems":1,"type":"array"},"receipt_sha256":{"items":{"type":"string"},"minItems":1,"type":"array"},"row_sha256":{"items":{"type":"string"},"minItems":1,"type":"array"},"typed_value_sha256":{"items":{"type":"string"},"minItems":1,"type":"array"}},"required":["typed_value_sha256","receipt_sha256","row_sha256","export_sha256"],"type":"object"},"canonical_roots":{"additionalProperties":false,"properties":{"full_case":{"const":"entire object with keys schema_version,payload,oracle","type":"string"},"oracle":{"const":"oracle object serialized as a standalone JSON document","type":"string"},"payload":{"const":"payload object serialized as a standalone JSON document","type":"string"}},"required":["full_case","payload","oracle"],"type":"object"},"canonicalization_id":{"const":"night-voyager.slice0.compact-sorted-utf8-lf.v1","type":"string"},"dataset_author_id":{"const":"independent-dataset-author-v3","type":"string"},"evaluator_id":{"const":"night-voyager-slice0-evaluator-v1","type":"string"},"holdout_content_included":{"const":false},"holdouts":{"items":{"additionalProperties":false,"properties":{"case_id":{"format":"uuid","type":"string"},"case_revision":{"minimum":1,"type":"integer"},"decision_dimension":{"enum":["application_timeline","program_requirements"],"type":"string"},"full_case_byte_length":{"minimum":1,"type":"integer"},"full_case_sha256":{"pattern":"^[0-9a-f]{64}$","type":"string"},"holdout_id":{"format":"uuid","type":"string"},"oracle_byte_length":{"minimum":1,"type":"integer"},"oracle_sha256":{"pattern":"^[0-9a-f]{64}$","type":"string"},"payload_byte_length":{"minimum":1,"type":"integer"},"payload_sha256":{"pattern":"^[0-9a-f]{64}$","type":"string"},"query_id":{"format":"uuid","type":"string"}},"required":["case_id","case_revision","decision_dimension","holdout_id","query_id","full_case_byte_length","full_case_sha256","payload_byte_length","payload_sha256","oracle_byte_length","oracle_sha256"],"type":"object"},"maxItems":4,"minItems":4,"type":"array"},"one_way_reveal_procedure_id":{"const":"nv.slice0.one-way-reveal.v1","type":"string"},"oracle_content_included":{"const":false},"producer_native_proof_commitment":{"additionalProperties":false,"properties":{"basename":{"minLength":1,"type":"string"},"byte_length":{"minimum":1,"type":"integer"},"sha256":{"pattern":"^[0-9a-f]{64}$","type":"string"}},"required":["basename","byte_length","sha256"],"type":"object"},"proposed_holdout_custodian_id":{"const":"independent-holdout-custodian-v3","type":"string"},"public_schemas":{"items":{"additionalProperties":false,"properties":{"basename":{"minLength":1,"type":"string"},"byte_length":{"minimum":1,"type":"integer"},"sha256":{"pattern":"^[0-9a-f]{64}$","type":"string"}},"required":["basename","byte_length","sha256"],"type":"object"},"maxItems":10,"minItems":10,"type":"array","uniqueItems":true},"rejected_pre_admission_revisions":{"const":[{"author_revision":1,"status":"rejected_pre_admission"},{"author_revision":2,"status":"rejected_pre_admission"}],"type":"array"},"schema_version":{"const":"night-voyager.evidence-loop-holdout-manifest.v1","type":"string"},"source_manifest_fragment":{"additionalProperties":false,"properties":{"basename":{"minLength":1,"type":"string"},"byte_length":{"minimum":1,"type":"integer"},"sha256":{"pattern":"^[0-9a-f]{64}$","type":"string"}},"required":["basename","byte_length","sha256"],"type":"object"}},"required":["schema_version","author_revision","dataset_author_id","evaluator_id","proposed_holdout_custodian_id","one_way_reveal_procedure_id","canonicalization_id","canonical_roots","baseline_fixture_boundary","baseline_hash_projection_keys","holdout_content_included","oracle_content_included","holdouts","a2_contract_basis","source_manifest_fragment","public_schemas","producer_native_proof_commitment","authority_graph","rejected_pre_admission_revisions"],"title":"Night Voyager Slice 0 Public Holdout Manifest V1 Revision 3","type":"object"}
