{"a2_contract_basis":{"basename":"a2-contract-basis-v1.json","byte_length":997,"sha256":"f4db4ab48d7e47bcc7645509e0b975bf4f6e87acf191f28cbed49807a2dc7580"},"author_revision":3,"authority_graph":{"dataset_author":"authors revision-3 semantics and commitments; has no custody, seal, or reveal authority","dra":"owns the frozen governed A2 baseline values and their provenance contract","holdout_custodian":"a later independent v3 custodian may own custody, seal, and one-way reveal; no custodian action is present here","mke":"owns producer-native ingestion, active Publication, Evidence descriptors, and trace identifiers","night_voyager":"owns evaluator-v1 case identity, thresholds, admissibility, mappings, and outcome decisions"},"baseline_fixture_boundary":{"a2_projection_and_hash_contract_required":true,"nature":"deterministic_public_safe_synthetic_governed_fixture","production_or_historical_user_receipt_claimed":false},"baseline_hash_projection_keys":{"export_sha256":["all row_sha256 projection keys","row_sha256","compact sorted-key UTF-8 JSON with one LF terminator"],"receipt_sha256":["receipt_id","assigned_advisor_id","decision","compact sorted-key UTF-8 JSON with one LF terminator"],"row_sha256":["schema_version","case_id","case_revision","decision_dimension","typed_row_id","typed_value","typed_value_sha256","producer","advisor_verification","origin_kind","compact sorted-key UTF-8 JSON with one LF terminator"],"typed_value_sha256":["exact typed_value UTF-8 bytes","no JSON encoding","no terminator"]},"canonical_roots":{"full_case":"entire object with keys schema_version,payload,oracle","oracle":"oracle object serialized as a standalone JSON document","payload":"payload object serialized as a standalone JSON document"},"canonicalization_id":"night-voyager.slice0.compact-sorted-utf8-lf.v1","dataset_author_id":"independent-dataset-author-v3","evaluator_id":"night-voyager-slice0-evaluator-v1","holdout_content_included":false,"holdouts":[{"case_id":"e0ca43d3-ee22-5a0a-98d5-97145682c4ec","case_revision":3,"decision_dimension":"program_requirements","full_case_byte_length":5142,"full_case_sha256":"2b3c6570fd2238bd01f14f45d9c241c2314f5ee5b84aea11167295d400dce682","holdout_id":"11de7afd-2917-53d6-962a-ac78047d8389","oracle_byte_length":769,"oracle_sha256":"c3ccd6b04503c2df98903c0eaa12116fc627122348869869a56c6ac13c61989f","payload_byte_length":4289,"payload_sha256":"fc7becf753c091ac492dd3ba81839774ba36fc44f8a53e45d93a7929a9f48a35","query_id":"df104280-cbca-506e-94e2-329e61a13a7d"},{"case_id":"6c9eb542-6d0f-5da0-825d-5e8935bc9c7d","case_revision":2,"decision_dimension":"application_timeline","full_case_byte_length":5062,"full_case_sha256":"b02f9dffb6f5ccd936b59ce454ca4834c67447ed0bba7cdb0864c12934e11e1a","holdout_id":"7c5031cc-cc1d-5fbb-91fe-daf83260d89c","oracle_byte_length":715,"oracle_sha256":"bffa47bae257ccaa3db97df8828592541e5e434c0d314199b5840ae9e53b7dfa","payload_byte_length":4263,"payload_sha256":"6e8c59642b33b695ddeb8ff10c30b165154d4f00e45f321fbbee02753e34954e","query_id":"e59f9eb1-da1b-5437-8971-9fc1570cfb7b"},{"case_id":"66898f7f-4566-5900-bb71-5ee9568e22eb","case_revision":4,"decision_dimension":"program_requirements","full_case_byte_length":4997,"full_case_sha256":"f0b0c8f43b4e1738e5db46badb9c98dc0db17ad31392895f970c3115ae1662d0","holdout_id":"841327fb-afbf-554d-bd41-34e07a7ff5b4","oracle_byte_length":680,"oracle_sha256":"078d18b1b226bfb8ae34299d7c531bc4862ca3b3ca711b0e22fe87df91f1ecae","payload_byte_length":4233,"payload_sha256":"189b6ba61fe362e341f505c05493da2735c541344f61c01f67d70c378e0c149e","query_id":"4d3f5f72-a256-5dec-afb4-8f4decde9543"},{"case_id":"0a2a9f77-c35c-56e8-94bd-e85ed83ff596","case_revision":5,"decision_dimension":"application_timeline","full_case_byte_length":5056,"full_case_sha256":"2cd8fd890ccbe7069e49540422d37a37930cd86d1c850056c1f2c9d3e260f14c","holdout_id":"5039cfeb-3d77-5ed7-b45f-807bfc5885d0","oracle_byte_length":712,"oracle_sha256":"597e88ae083629b65d03f6d6825b3985a654813886ab141ce91d601817d9fb3e","payload_byte_length":4260,"payload_sha256":"2aec124655a0ec2049c56b2fcf5deed98caf9731df13c42c9173d3b42a38b2c7","query_id":"559649e2-7840-51c4-b929-5cc25e34a371"}],"one_way_reveal_procedure_id":"nv.slice0.one-way-reveal.v1","oracle_content_included":false,"producer_native_proof_commitment":{"basename":"native-source-proof-v1.json","byte_length":8717,"sha256":"a81b1100727aee498eec5194d7da6f18b4059e337644b44348e2298e0eb97df5"},"proposed_holdout_custodian_id":"independent-holdout-custodian-v3","public_schemas":[{"basename":"a2-contract-basis-schema-v1.json","byte_length":1260,"sha256":"26c6389dfa9ac114b85e9402505547bd3cdcc2e6c43f6cbfa97ec1ce946fbaaf"},{"basename":"author-staging-manifest-schema-v3.json","byte_length":5486,"sha256":"722dcb1e96f68c1c728f9727b58ec4ab9621d53b420103e6db9380f7188b7f80"},{"basename":"holdout-answer-key-schema-v1.json","byte_length":1772,"sha256":"973d8cd69cfc518de3c2756795f26a0c3adf7bb21b0e09c23239c9fb62aef2e5"},{"basename":"holdout-case-schema-v1.json","byte_length":10455,"sha256":"676ed761a873f30458cba49b09307144011a67a17933029ba1f7aefcbda61f20"},{"basename":"holdout-dataset-schema-v1.json","byte_length":10831,"sha256":"c42590c8be99a786cf685882c7a4f85f117bd733201e7084a30e6b8069e5f958"},{"basename":"holdout-manifest-schema-v1.json","byte_length":5782,"sha256":"21ae1ff6979040989f6686e405f6c6011dd6bbc77d27e00a67a689e289b1624f"},{"basename":"holdout-oracle-schema-v1.json","byte_length":1933,"sha256":"227bf4c38d2ad849161e086e158929791095c91c3ba602e756bfec6b418b8700"},{"basename":"holdout-oracle-set-schema-v1.json","byte_length":2362,"sha256":"c914ed148697faee6ca47ce61540702c6031dd6f60afccd9dce517e1c8b1faef"},{"basename":"holdout-payload-schema-v1.json","byte_length":8481,"sha256":"6de5586111c04bf965c0a43dceda11047a004e8417fe258b2b26f6fd95c2b3b0"},{"basename":"source-manifest-fragment-schema-v1.json","byte_length":8274,"sha256":"9f0e918c88901deab177cdc7c2fc6dac74cf5bf2c38a70964576ce9740ecbd34"}],"rejected_pre_admission_revisions":[{"author_revision":1,"status":"rejected_pre_admission"},{"author_revision":2,"status":"rejected_pre_admission"}],"schema_version":"night-voyager.evidence-loop-holdout-manifest.v1","source_manifest_fragment":{"basename":"source-manifest-fragment-v1.json","byte_length":11549,"sha256":"d9926321da8c244e93d93afd4e8a5c4571aa14ceac4a7913644a887f195c0793"}}
